{
  "$schema": "https://json-schema.org/draft/2020-12/schema",
  "$id": "openmontage/artifacts/edit_decisions",
  "title": "Edit Decisions",
  "description": "Editorial decisions produced by the Edit Agent.",
  "type": "object",
  "required": ["version", "cuts", "render_runtime"],
  "properties": {
    "version": { "type": "string", "const": "1.0" },
    "cuts": {
      "type": "array",
      "items": {
        "type": "object",
        "required": ["id", "source", "in_seconds", "out_seconds"],
        "properties": {
          "id": { "type": "string" },
          "source": { "type": "string", "description": "Source file path or asset-manifest ID" },
          "in_seconds": { "type": "number", "minimum": 0 },
          "out_seconds": { "type": "number", "minimum": 0 },
          "type": {
            "type": "string",
            "description": "Remotion templated scene type such as text_card or callout"
          },
          "text": { "type": "string" },
          "title": { "type": "string" },
          "subtitle": { "type": "string" },
          "callout_type": {
            "type": "string",
            "enum": ["info", "warning", "tip", "quote"]
          },
          "speed": { "type": "number", "minimum": 0.1, "default": 1.0 },
          "layer": {
            "type": "string",
            "enum": ["primary", "overlay", "background"],
            "default": "primary"
          },
          "transform": {
            "type": "object",
            "properties": {
              "scale": { "type": "number", "minimum": 0, "default": 1.0 },
              "position": { "type": "string", "default": "center" },
              "animation": {
                "type": "string",
                "description": "Motion applied to still images (e.g. ken-burns-slow-zoom, pan-left, static)"
              },
              "crop": {
                "type": "object",
                "properties": {
                  "x": { "type": "number" },
                  "y": { "type": "number" },
                  "width": { "type": "number" },
                  "height": { "type": "number" }
                }
              }
            },
            "additionalProperties": false
          },
          "transition_in": {
            "type": "string",
            "description": "Transition type entering this cut (e.g. fade, dissolve, cut, wipe)"
          },
          "transition_out": {
            "type": "string",
            "description": "Transition type leaving this cut"
          },
          "transition_duration": {
            "type": "number",
            "minimum": 0,
            "description": "Duration of transition in seconds"
          },
          "reason": { "type": "string" },
          "label": { "type": "string" },
          "primaryValue": { "type": ["string", "number"] },
          "supportingMetrics": {
            "type": "array",
            "items": {
              "type": "object",
              "required": ["label", "value"],
              "properties": {
                "label": { "type": "string" },
                "value": { "type": ["string", "number"] },
                "direction": { "type": "string", "enum": ["up", "down", "flat"] }
              },
              "additionalProperties": false
            }
          },
          "period": { "type": "string" },
          "sourceLabel": { "type": "string" },
          "sourceDate": { "type": "string" },
          "sampleData": { "type": "boolean" },
          "interpretation": { "type": "string" },
          "variant": { "type": "string" },
          "metric": { "type": "string" },
          "expectedValue": { "type": ["string", "number"] },
          "actualValue": { "type": ["string", "number"] },
          "delta": { "type": ["string", "number"] },
          "unit": { "type": "string" },
          "nodes": {
            "type": "array",
            "items": {
              "type": "object",
              "required": ["id", "label"],
              "properties": {
                "id": { "type": "string" },
                "label": { "type": "string" },
                "value": { "type": ["string", "number"] },
                "detail": { "type": "string" }
              },
              "additionalProperties": false
            }
          },
          "edges": {
            "type": "array",
            "items": {
              "type": "object",
              "required": ["from", "to"],
              "properties": {
                "from": { "type": "string" },
                "to": { "type": "string" },
                "value": { "type": "number" },
                "label": { "type": "string" },
                "relation": { "type": "string", "enum": ["positive", "negative", "uncertain"] }
              },
              "additionalProperties": false
            }
          },
          "highlightedPath": { "type": "array", "items": { "type": "string" } },
          "activeNodeId": { "type": "string" },
          "hypothesis": { "type": "boolean" },
          "events": {
            "type": "array",
            "items": {
              "type": "object",
              "required": ["date", "title"],
              "properties": {
                "date": { "type": "string" },
                "title": { "type": "string" },
                "description": { "type": "string" },
                "source": { "type": "string" }
              },
              "additionalProperties": false
            }
          },
          "highlightedIndex": { "type": "integer", "minimum": 0 },
          "scenarios": {
            "type": "array",
            "items": {
              "type": "object",
              "required": ["name", "description", "trigger"],
              "properties": {
                "name": { "type": "string" },
                "title": { "type": "string" },
                "description": { "type": "string" },
                "trigger": { "type": "string" },
                "probability": { "type": "number", "minimum": 0, "maximum": 100 },
                "metrics": { "type": "array", "items": { "type": "string" } }
              },
              "additionalProperties": false
            }
          },
          "highlightedScenario": { "type": "string" },
          "thesis": { "type": "string" },
          "conditions": {
            "type": "array",
            "minItems": 1,
            "maxItems": 4,
            "items": {
              "oneOf": [
                { "type": "string" },
                {
                  "type": "object",
                  "required": ["title"],
                  "properties": {
                    "title": { "type": "string" },
                    "description": { "type": "string" },
                    "evidenceToWatch": { "type": "string" }
                  },
                  "additionalProperties": false
                }
              ]
            }
          },
          "canvasMode": { "type": "string", "enum": ["paper", "document", "data", "margin-note", "dark-ink", "full-bleed"] },
          "density": { "type": "string", "enum": ["sparse", "standard", "dense"] },
          "headerTreatment": { "type": "string", "enum": ["full", "compact", "none"] },
          "sourceTreatment": { "type": "string", "enum": ["full", "compact", "inline"] },
          "analystNote": { "type": "string" },
          "evidenceIndex": { "type": "string" }
          ,
          "initialReveal": { "type": "boolean" }
        },
        "additionalProperties": false
      }
    },
    "overlays": {
      "type": "array",
      "items": {
        "type": "object",
        "required": ["asset_id", "start_seconds", "end_seconds", "position"],
        "properties": {
          "asset_id": { "type": "string" },
          "start_seconds": { "type": "number", "minimum": 0 },
          "end_seconds": { "type": "number", "minimum": 0 },
          "position": {
            "type": "object",
            "properties": {
              "x": { "type": "number" },
              "y": { "type": "number" },
              "width": { "type": "number" },
              "height": { "type": "number" }
            },
            "required": ["x", "y"]
          },
          "animation": { "type": "string" },
          "opacity": { "type": "number", "minimum": 0, "maximum": 1 }
        },
        "additionalProperties": false
      }
    },
    "audio": {
      "type": "object",
      "description": "Audio configuration for narration, music, and SFX.",
      "properties": {
        "narration": {
          "type": "object",
          "properties": {
            "asset_id": {
              "type": "string",
              "description": "Optional single-track narration form for explicitly approved single-pass projects or supplied source audio."
            },
            "start_seconds": { "type": "number", "minimum": 0 },
            "end_seconds": { "type": "number", "minimum": 0 },
            "volume": { "type": "number", "minimum": 0, "maximum": 1 },
            "segments": {
              "type": "array",
              "description": "Default narration form: ordered references to separately synthesized script-section assets.",
              "items": {
                "type": "object",
                "required": ["asset_id", "start_seconds"],
                "properties": {
                  "asset_id": { "type": "string" },
                  "start_seconds": { "type": "number", "minimum": 0 },
                  "end_seconds": { "type": "number", "minimum": 0 }
                },
                "additionalProperties": false
              }
            }
          }
        },
        "music": {
          "type": "object",
          "required": ["asset_id"],
          "description": "Approved background-music layer. Omit this property entirely when the resolved music source is none.",
          "properties": {
            "asset_id": { "type": "string" },
            "volume": { "type": "number", "minimum": 0, "maximum": 1 },
            "fade_in_seconds": { "type": "number", "minimum": 0 },
            "fade_out_seconds": { "type": "number", "minimum": 0 },
            "ducking": {
              "oneOf": [
                { "type": "boolean" },
                {
                  "type": "object",
                  "properties": {
                    "enabled": { "type": "boolean", "default": true },
                    "threshold_db": { "type": "number" },
                    "reduction_db": { "type": "number" },
                    "attack_ms": { "type": "number", "minimum": 0 },
                    "release_ms": { "type": "number", "minimum": 0 }
                  },
                  "additionalProperties": false
                }
              ]
            }
          }
        },
        "sfx": {
          "type": "array",
          "items": {
            "type": "object",
            "properties": {
              "asset_id": { "type": "string" },
              "start_seconds": { "type": "number", "minimum": 0 },
              "volume": { "type": "number", "minimum": 0, "maximum": 1, "default": 1.0 }
            },
            "additionalProperties": false
          }
        }
      },
      "additionalProperties": false
    },
    "subtitles": {
      "type": "object",
      "properties": {
        "enabled": { "type": "boolean" },
        "style": { "type": "string", "description": "Display style: sentence, word-by-word, karaoke" },
        "source": { "type": "string", "description": "Path to subtitle file or asset ID" },
        "font": { "type": "string" },
        "font_size": { "type": "integer" },
        "color": { "type": "string", "description": "Primary text color (hex or ASS format)" },
        "highlight_color": { "type": "string", "description": "Active caption color. Set equal to color for a stable non-karaoke treatment." },
        "outline_color": { "type": "string" },
        "background": { "type": "string", "description": "Background color with optional alpha (e.g. #00000088)" },
        "position": { "type": "string", "enum": ["top-center", "bottom-center", "center"] },
        "max_words_per_line": { "type": "integer", "minimum": 1 },
        "safe_area": {
          "type": "object",
          "description": "Caption clearance from social-platform UI. For portrait outputs the renderer clamps these values to the shared social-ui-safe minimum.",
          "properties": {
            "policy": { "type": "string", "enum": ["social-ui-safe", "custom"] },
            "bottom_offset_px": { "type": "integer", "minimum": 0 },
            "side_margin_px": { "type": "integer", "minimum": 0 }
          },
          "additionalProperties": false
        }
      },
      "additionalProperties": false
    },
    "music": {
      "type": "object",
      "description": "Legacy top-level music config. Prefer audio.music for new pipelines.",
      "properties": {
        "asset_id": { "type": "string" },
        "volume": { "type": "number", "minimum": 0, "maximum": 1 },
        "ducking": { "type": "boolean", "default": true },
        "fade_in_seconds": { "type": "number", "minimum": 0 },
        "fade_out_seconds": { "type": "number", "minimum": 0 }
      }
    },
    "transitions": {
      "type": "array",
      "description": "Global transition list. Per-cut transitions in cuts[].transition_in/out are preferred.",
      "items": {
        "type": "object",
        "properties": {
          "type": { "type": "string" },
          "at_seconds": { "type": "number" },
          "duration_seconds": { "type": "number", "minimum": 0 }
        },
        "required": ["type", "at_seconds", "duration_seconds"]
      }
    },
    "renderer_family": {
      "type": "string",
      "enum": ["explainer-data", "explainer-teacher", "cinematic-trailer", "documentary-montage", "product-reveal", "screen-demo", "presenter", "animation-first"],
      "description": "Locked at proposal stage — creative grammar for this deliverable. Preserved from proposal_packet; edit MUST NOT change without a logged decision."
    },
    "render_runtime": {
      "type": "string",
      "enum": ["remotion", "hyperframes", "ffmpeg"],
      "description": "Locked at proposal stage — technical runtime that realizes renderer_family. Edit MUST carry this forward unchanged unless a logged render_runtime_selection decision overrides it."
    },
    "composition_mode": {
      "type": "string",
      "enum": ["templated", "atelier"],
      "description": "Locked at proposal — HOW the composition is built. Edit MUST carry forward unchanged. 'atelier' routes video_compose to _render_via_atelier (no cut-schema, no stock registry); requires `bespoke` block below."
    },
    "width": { "type": "integer", "minimum": 1, "description": "Explicit Remotion composition width in pixels." },
    "height": { "type": "integer", "minimum": 1, "description": "Explicit Remotion composition height in pixels." },
    "brand": {
      "type": "object",
      "description": "Optional public-facing Finance Dossier identity. Engine names are never rendered by default.",
      "properties": {
        "label": { "type": "string" },
        "series": { "type": "string" },
        "issue": { "type": "string" }
      },
      "additionalProperties": false
    },
    "bespoke": {
      "type": "object",
      "description": "Required when composition_mode='atelier'. Contract for the hand-authored, project-local Remotion render. See tools/video/video_compose.py → _render_via_atelier docstring.",
      "required": ["entry", "composition_id", "art_direction"],
      "properties": {
        "entry": { "type": "string", "description": "Path to the project-local Remotion entry .tsx (typically projects/<slug>/index.tsx). If outside remotion-composer/, auto-staged via directory junction/symlink at render time." },
        "composition_id": { "type": "string", "description": "id registered in that entry's Root" },
        "art_direction": { "type": "string", "description": "Short commitment to a fresh visual language (or a path to art-direction.md). REQUIRED — enforced by _run_atelier_checks." },
        "props_path": { "type": "string", "description": "Absolute path to a props JSON (Remotion --props)" },
        "public_dir": { "type": "string", "description": "Per-project public dir (avoids copying the bloated shared remotion-composer/public/)" },
        "scale": { "type": "number", "minimum": 0.1, "maximum": 1.0 },
        "crf": { "type": "integer", "minimum": 0, "maximum": 51 },
        "concurrency": { "type": "integer", "minimum": 1 }
      }
    },
    "slideshow_risk_score": {
      "type": "object",
      "description": "Slideshow risk assessment from lib/slideshow_risk.py",
      "properties": {
        "average": { "type": "number" },
        "verdict": { "type": "string", "enum": ["strong", "acceptable", "revise", "fail"] }
      }
    },
    "metadata": { "type": "object" }
  },
  "additionalProperties": false
}
