{
 "version": "1.0",
 "renderer_family": "explainer-data",
 "render_runtime": "remotion",
 "composition_mode": "atelier",
 "width": 1080,
 "height": 1920,
 "brand": {
  "label": "",
  "series": "",
  "issue": ""
 },
 "cuts": [
  {
   "id": "cut-01",
   "source": "bespoke:question-cascade",
   "type": "text_card",
   "variant": "question-cascade",
   "label": "sc01 开场提问",
   "in_seconds": 0.0,
   "out_seconds": 4.6,
   "reason": "4.6 秒内建立一个可比前提：同一天、同一笔钱、同一终点。不解释任何概念，也不出现系列标识。",
   "transition_in": "冷开场，无转场铺垫",
   "transition_out": "硬切",
   "layer": "primary",
   "canvasMode": "paper",
   "density": "sparse",
   "headerTreatment": "none",
   "sourceTreatment": "inline",
   "sourceLabel": "区间起点与初始资金，见口径说明",
   "sourceDate": "2020-07-03 起",
   "interpretation": "在 4.6 秒内建立「同一天、同一笔钱、同一终点」的可比前提，不解释任何概念",
   "initialReveal": true
  },
  {
   "id": "cut-02",
   "source": "bespoke:evidence_card",
   "type": "diagram",
   "variant": "chip-row",
   "label": "sc02 四只身份牌",
   "in_seconds": 4.6,
   "out_seconds": 9.4,
   "reason": "曲线出现之前先建立四条线的身份与代码；跟随数值签此后才有指代对象。",
   "transition_in": "硬切，无转场效果",
   "transition_out": "硬切",
   "layer": "primary",
   "canvasMode": "data",
   "density": "standard",
   "headerTreatment": "none",
   "sourceTreatment": "inline",
   "sourceLabel": "基金公司与交易所公开产品资料：名称、代码、跟踪指数、成立时间",
   "sourceDate": "截至 2026-09",
   "interpretation": "在曲线出现之前让观众认识四条线的身份与代码，后续跟随标签才有指代对象",
   "initialReveal": false
  },
  {
   "id": "cut-03",
   "source": "bespoke:document",
   "type": "text_card",
   "variant": "rule-sheet",
   "label": "sc03 规则公布",
   "in_seconds": 9.4,
   "out_seconds": 13.2,
   "reason": "口径前置：把「分红按再投资处理」说在曲线之前，避免观众误读为账户里收到的现金分红。",
   "transition_in": "硬切，无转场效果",
   "transition_out": "硬切",
   "layer": "primary",
   "canvasMode": "document",
   "density": "standard",
   "headerTreatment": "none",
   "sourceTreatment": "full",
   "sourceLabel": "用户工作簿「口径说明」工作表：后复权口径、账户资产公式、区间端点",
   "sourceDate": "2020-07-03 至 2026-09-18",
   "interpretation": "口径前置：先说明这是分红按再投资处理的总回报，避免观众误读为账户里收到的现金分红",
   "initialReveal": false
  },
  {
   "id": "cut-04",
   "source": "bespoke:chart",
   "type": "animation",
   "variant": "normalized-line-race",
   "label": "sc04 连续赛跑（7 个注解拍）",
   "in_seconds": 13.2,
   "out_seconds": 70.0,
   "reason": "全片信息主干：一个连续 56.8 秒的坐标系，四条曲线同步揭示。赛跑期间没有任何剪辑，七个章节只以注解拍叠加。",
   "transition_in": "硬切，无转场效果",
   "transition_out": "硬切",
   "layer": "primary",
   "canvasMode": "data",
   "density": "dense",
   "headerTreatment": "none",
   "sourceTreatment": "inline",
   "sourceLabel": "腾讯证券行情接口 日线后复权（hfq），1510 个交易日，四个数值取自同一截面",
   "sourceDate": "2020-07-03 至 2026-09-18",
   "interpretation": "把「同一起点、同一时间、不同路径」变成可看见的连续过程；七个注解拍承载章节，全程不剪辑",
   "initialReveal": false
  },
  {
   "id": "cut-05",
   "source": "bespoke:evidence_card",
   "type": "diagram",
   "variant": "result-ledger",
   "label": "sc05 冻结最终结果",
   "in_seconds": 70.0,
   "out_seconds": 76.4,
   "reason": "先把结果钉住（停留 6.4 秒供阅读），后面拆过程时观众才有对照物。",
   "transition_in": "硬切，无转场效果",
   "transition_out": "硬切",
   "layer": "primary",
   "canvasMode": "data",
   "density": "standard",
   "headerTreatment": "none",
   "sourceTreatment": "full",
   "sourceLabel": "同区间的最终资产、累计收益率与年化收益率，口径与曲线场景一致",
   "sourceDate": "2020-07-03 至 2026-09-18",
   "interpretation": "先让观众记住结果再拆过程；停留 6.4 秒供阅读",
   "initialReveal": false
  },
  {
   "id": "cut-06",
   "source": "bespoke:single-turn",
   "type": "text_card",
   "variant": "single-turn",
   "label": "sc06 转折",
   "in_seconds": 76.4,
   "out_seconds": 79.6,
   "reason": "用一个反问把注意力从「结果」切到「过程」，为随后两张图铺垫。",
   "transition_in": "硬切，无转场效果",
   "transition_out": "硬切",
   "layer": "primary",
   "canvasMode": "paper",
   "density": "sparse",
   "headerTreatment": "none",
   "sourceLabel": "最大回撤幅度与其跨度，来源见紧接的两个场景",
   "interpretation": "把观众注意力从「结果」切换到「过程」，为回撤的两张图铺垫",
   "initialReveal": false
  },
  {
   "id": "cut-07",
   "source": "bespoke:causal_chain",
   "type": "diagram",
   "variant": "rule-compare",
   "label": "sc07 规则不同，路径不同",
   "in_seconds": 79.6,
   "out_seconds": 85.2,
   "reason": "回答「为什么路径会分化」：两栏规则对照 + 明确的限定文字，不使用单条确定箭头。",
   "transition_in": "硬切，无转场效果",
   "transition_out": "硬切",
   "layer": "primary",
   "canvasMode": "margin-note",
   "density": "standard",
   "headerTreatment": "none",
   "sourceTreatment": "full",
   "sourceLabel": "中证指数有限公司编制公告（沪深300 与中证500 按调整市值加权）；上海证券交易所 ETF 产品页（中证红利低波动指数按股息率加权）",
   "sourceDate": "现行编制方案，截至 2026-08 公开资料",
   "interpretation": "回答「为什么路径会分化」：差别在指数的加权规则，不在基金经理",
   "initialReveal": false
  },
  {
   "id": "cut-08",
   "source": "bespoke:chart",
   "type": "animation",
   "variant": "zero-baseline-bars",
   "label": "sc08 最大回撤（零基线横向柱）",
   "in_seconds": 85.2,
   "out_seconds": 90.4,
   "reason": "给出回撤幅度的可比视图。零基线，绝不截断横轴放大差异。",
   "transition_in": "硬切，无转场效果",
   "transition_out": "硬切",
   "layer": "primary",
   "canvasMode": "data",
   "density": "standard",
   "headerTreatment": "none",
   "sourceTreatment": "inline",
   "sourceLabel": "每日账户资产相对此前历史峰值的最大跌幅，四只同一算法",
   "sourceDate": "峰值日与低点日见各行标注，区间 2020-07-03 至 2026-09-18",
   "interpretation": "给出回撤幅度的可比视图；零基线，绝不截断横轴放大差异",
   "initialReveal": false
  },
  {
   "id": "cut-09",
   "source": "bespoke:chart",
   "type": "animation",
   "variant": "underwater-strips",
   "label": "sc09 最长一段没回到前高",
   "in_seconds": 90.4,
   "out_seconds": 94.2,
   "reason": "本片最锋利的发现：回撤不只是幅度问题，是能不能熬过去的问题。用时间条回答「等了多久」。",
   "transition_in": "硬切，无转场效果",
   "transition_out": "硬切",
   "layer": "primary",
   "canvasMode": "data",
   "density": "standard",
   "headerTreatment": "none",
   "sourceTreatment": "inline",
   "sourceLabel": "当日账户资产低于此前历史最高值的连续区间，按交易日计数",
   "sourceDate": "各自最长的一段未创新高区间，见各行标注",
   "interpretation": "本片最锋利的发现：回撤不只是幅度问题，是能不能熬过去的问题",
   "initialReveal": false
  },
  {
   "id": "cut-10",
   "source": "bespoke:group-close",
   "type": "text_card",
   "variant": "group-close",
   "label": "sc10 结尾与合规",
   "in_seconds": 94.2,
   "out_seconds": 99.0,
   "reason": "给出可复用的判断动作与边界条件，并以原生页脚完成强制合规呈现。",
   "transition_in": "硬切，无转场效果",
   "transition_out": "硬切",
   "layer": "primary",
   "canvasMode": "paper",
   "density": "sparse",
   "headerTreatment": "none",
   "sourceTreatment": "full",
   "sourceLabel": "全片数据来源与编制规则来源的合并声明；合规文案为 AGENT_GUIDE 原文",
   "sourceDate": "2020-07-03 至 2026-09-18",
   "interpretation": "给出可复用的判断动作与边界条件，并以原生页脚完成强制合规呈现",
   "initialReveal": false
  }
 ],
 "bespoke": {
  "entry": "projects/etf-100k-four-fund-race/index.tsx",
  "composition_id": "EtfFourFundRace",
  "art_direction": "projects/etf-100k-four-fund-race/art-direction-instrument-plate.md",
  "props_path": "projects/etf-100k-four-fund-race/artifacts/props.json",
  "public_dir": "/Users/jishubu/project/OpenMontage/projects/etf-100k-four-fund-race/public",
  "scale": 1.0,
  "crf": 18,
  "concurrency": 8
 },
 "subtitles": {
  "enabled": false,
  "style": "none",
  "position": "bottom-center",
  "safe_area": {
   "policy": "social-ui-safe",
   "bottom_offset_px": 520,
   "side_margin_px": 96
  }
 },
 "transitions": [],
 "slideshow_risk_score": {
  "average": 0.18,
  "verdict": "strong"
 },
 "metadata": {
  "content_category": "finance",
  "subtitles_note": "本片无口播、无音轨，因此不存在字幕轨：没有任何语音需要被转写，加上一层字幕只会与画面排版重复同一句话。承载叙事的文字全部是原生场景排版，并已按 social-ui-safe 车道留出距底 520px、距侧 96px 的净空。subtitles 块仍显式声明安全区数值，供渲染后按实测复核。",
  "no_audio_layer": true,
  "audio_omitted_reason": "用户显式选择全程无口播；持久无 BGM 默认。本文件不含 audio 与 music 键，成片音轨数为 0。",
  "music_omitted": true,
  "no_gaps_verified": true,
  "timeline_total_seconds": 99.0,
  "runtime_locks": {
   "render_runtime": "remotion",
   "composition_mode": "atelier",
   "renderer_family": "explainer-data"
  },
  "render_grammar": "explainer-data",
  "annotation_beats_note": "赛跑场景 cut-04 的七个注解拍（2021-02 见顶 / 2021 收官 / 2022 首次收于起点以下 / 2022 收官 / 2024-02 极值 / 2024 收官 / 2025-11 双雄见顶）是合成内部的时间驱动注解，不是资产叠加层，因此不写入 overlays（overlays 的条目要求 asset_id，而本片没有任何叠加资产）。它们的时刻由 build_timeline_ts.py 从真实数据时点线性映射到场景局部秒数。",
  "end_card_note": "脚本为 ch-end 准备了「区间终点」卡，但其时刻正好落在 cut-04 的最后一帧，无法形成可读的停留。因此该卡不参与渲染；终点信息改由 cut-05 的「冻结」表头承担，赛跑场景末帧的顶部日期读数本身也已走到 2026-09-18。",
  "directional_color_rule": "本片不使用红绿涨跌语义。四条线色是身份色；任何强调都使用深墨反白块，且必与文字标签或数值同时出现。柱状图与时间条逐行标注名称。",
  "precision_layer_rule": "全部金额、比例、日期与时长由 Remotion 确定性图层渲染；所有数值来自 build_script.py 生成的内容台本，屏幕文案中不含手写数字。",
  "safe_area_rule": "竖屏安全区：可读文字必须落在 y ≤ 1400、x ∈ [96, 984]。合规页脚位于 y 1326–1360，在净空之内。",
  "compliance": {
   "content_category": "finance",
   "financial_disclaimer": "本视频仅作知识分享，不构成任何投资建议。市场有风险，投资需谨慎。",
   "exact_text": "本视频仅作知识分享，不构成任何投资建议。市场有风险，投资需谨慎。",
   "presentation": "footer",
   "placement": "ending",
   "ending_cut_id": "cut-10",
   "note": "合规文案以原生小字固定呈现在最终意义 cut-10 的页脚，不朗读、不单独成卡。"
  },
  "intentional_exceptions": [
   "cut-04 时长 56.8 秒，远超常规单场时长：它是连续的收益竞速镜头，七个章节为叠加注解而非剪辑点。"
  ],
  "semantic_motion_map": [
   {
    "scene": "cut-04",
    "why": "把「同一起点、同一时间、不同路径」变成可看见的连续过程，是全片的证据主干。"
   },
   {
    "scene": "cut-09",
    "why": "用时间条而非柱状图回答「等了多久」，与 cut-08 的幅度柱形成结构对照。"
   }
  ]
 }
}